{
  "artifact_type": "gtm_patch_package",
  "schema_version": "1.0.0",
  "run_id": "golden-synthetic-ecommerce-001",
  "client_id": null,
  "source_container_summary": {
    "input_file_name": "synthetic-ecommerce-missing-fields.json",
    "account_id": "9001",
    "container_id": "5105",
    "container_name": "Synthetic Ecommerce Missing Fields Container",
    "export_format_version": 2,
    "entity_counts": {
      "tags": 1,
      "triggers": 1,
      "variables": 2,
      "folders": 1,
      "templates": 0
    }
  },
  "standards_applied": [
    {
      "standard_id": "gtm-audit-rule-catalog",
      "name": "GTM Audit Rule Catalog",
      "version": "1.0.0",
      "source": "agency_standard"
    }
  ],
  "package_files": {
    "optimized_container_json": {
      "file_name": "optimized_container.json",
      "media_type": "application/json",
      "required": true,
      "description": "Draft proposed GTM container export JSON."
    },
    "audit_report_md": {
      "file_name": "audit_report.md",
      "media_type": "text/markdown",
      "required": true,
      "description": "Human-readable audit report."
    },
    "audit_report_json": {
      "file_name": "audit_report.json",
      "media_type": "application/json",
      "required": true,
      "description": "Machine-readable audit findings."
    },
    "change_log_json": {
      "file_name": "change_log.json",
      "media_type": "application/json",
      "required": true,
      "description": "Machine-readable proposed change log."
    },
    "validation_report_json": {
      "file_name": "validation_report.json",
      "media_type": "application/json",
      "required": true,
      "description": "Machine-readable validation summary."
    },
    "qa_checklist_md": {
      "file_name": "qa_checklist.md",
      "media_type": "text/markdown",
      "required": true,
      "description": "Human-readable QA checklist."
    },
    "run_metadata_json": {
      "file_name": "run_metadata.json",
      "media_type": "application/json",
      "required": true,
      "description": "Machine-readable run metadata."
    }
  },
  "optimized_container": {
    "file_name": "optimized_container.json",
    "artifact_status": "draft_proposal",
    "publish_ready": false,
    "human_review_required": true,
    "container": {
      "exportFormatVersion": 2,
      "exportTime": "2026-06-09 00:00:00",
      "containerVersion": {
        "accountId": "9001",
        "containerId": "5105",
        "name": "Synthetic Ecommerce Missing Fields Version",
        "container": {
          "accountId": "9001",
          "containerId": "5105",
          "name": "Synthetic Ecommerce Missing Fields Container",
          "publicId": "GTM-SYN505"
        },
        "tag": [
          {
            "accountId": "9001",
            "containerId": "5105",
            "tagId": "105",
            "name": "GA4 - Event - purchase",
            "type": "gaawe",
            "firingTriggerId": [
              "205"
            ],
            "parentFolderId": "405",
            "parameter": [
              {
                "type": "template",
                "key": "eventName",
                "value": "purchase"
              },
              {
                "type": "template",
                "key": "measurementId",
                "value": "{{CONST - GA4 Measurement ID}}"
              },
              {
                "type": "template",
                "key": "value",
                "value": "{{DLV - ecommerce.value}}"
              }
            ],
            "fingerprint": "synthetic-ecommerce-tag-105"
          }
        ],
        "trigger": [
          {
            "accountId": "9001",
            "containerId": "5105",
            "triggerId": "205",
            "name": "CE - purchase",
            "type": "CUSTOM_EVENT",
            "fingerprint": "synthetic-ecommerce-trigger-205"
          }
        ],
        "variable": [
          {
            "accountId": "9001",
            "containerId": "5105",
            "variableId": "305",
            "name": "CONST - GA4 Measurement ID",
            "type": "c",
            "parameter": [
              {
                "type": "template",
                "key": "value",
                "value": "G-TEST505"
              }
            ],
            "fingerprint": "synthetic-ecommerce-variable-305"
          },
          {
            "accountId": "9001",
            "containerId": "5105",
            "variableId": "306",
            "name": "DLV - ecommerce.value",
            "type": "v",
            "parameter": [
              {
                "type": "template",
                "key": "name",
                "value": "ecommerce.value"
              }
            ],
            "fingerprint": "synthetic-ecommerce-variable-306"
          }
        ],
        "folder": [
          {
            "accountId": "9001",
            "containerId": "5105",
            "folderId": "405",
            "name": "GA4 - Ecommerce",
            "fingerprint": "synthetic-ecommerce-folder-405"
          }
        ],
        "builtInVariable": [
          {
            "accountId": "9001",
            "containerId": "5105",
            "type": "PAGE_URL",
            "name": "Page URL"
          }
        ],
        "customTemplate": []
      }
    }
  },
  "audit_report": {
    "file_name_md": "audit_report.md",
    "file_name_json": "audit_report.json",
    "summary": "Expected ecommerce audit for a synthetic purchase tag missing clear transaction ID and currency mappings.",
    "findings": [
      {
        "finding_id": "synthetic-ecommerce-001-finding-001",
        "severity": "high",
        "category": "ecommerce",
        "title": "Purchase event lacks key ecommerce field mappings",
        "evidence": [
          {
            "entity_type": "tag",
            "entity_id": "105",
            "entity_name": "GA4 - Event - purchase",
            "observation": "Purchase tag includes value mapping but no clear transaction_id mapping."
          },
          {
            "entity_type": "tag",
            "entity_id": "105",
            "entity_name": "GA4 - Event - purchase",
            "observation": "Purchase tag does not include a clear currency mapping."
          }
        ],
        "proposed_change_ids": [
          "synthetic-ecommerce-001-change-001"
        ],
        "human_review_required": true
      }
    ]
  },
  "change_log": [
    {
      "change_id": "synthetic-ecommerce-001-change-001",
      "change_type": "no_change",
      "entity_type": "tag",
      "entity_id": "105",
      "entity_name": "GA4 - Event - purchase",
      "reason": "Ecommerce payload changes require human review and test-order QA; no automatic field changes are expected.",
      "risk_level": "high",
      "rollback_notes": "No GTM configuration change is expected for this golden fixture.",
      "related_finding_ids": [
        "synthetic-ecommerce-001-finding-001"
      ],
      "status": "proposed",
      "human_approval_required": true
    }
  ],
  "validation_report": {
    "file_name": "validation_report.json",
    "validation_status": "pass",
    "checks": [
      {
        "check_id": "fixture-structure",
        "status": "pass",
        "message": "Ecommerce fixture is structurally valid GTM-like JSON."
      }
    ]
  },
  "risk_summary": {
    "overall_risk": "high",
    "high_risk_change_count": 1,
    "manual_review_required": true,
    "notes": [
      "Expected output should recommend test-order QA and data layer documentation review."
    ]
  },
  "qa_checklist": [
    {
      "item_id": "qa-synthetic-ecommerce-001-001",
      "description": "Use GTM Preview and a test purchase to verify transaction_id, value, currency, and item data before trusting ecommerce reporting.",
      "status": "todo",
      "required": true
    }
  ],
  "run_metadata": {
    "file_name": "run_metadata.json",
    "created_at": "2026-06-09T00:00:00Z",
    "input_files": [
      "examples/synthetic-gtm-containers/synthetic-ecommerce-missing-fields.json"
    ],
    "mlp_version": "1.0.0",
    "tool_version": null
  },
  "human_approval_required": true,
  "publishes_gtm_changes": false
}
